{
  "$schema": "https://json-schema.org/draft/2020-12/schema",
  "$id": "https://spexmachina.dev/schema/project.json",
  "title": "Spex Machina Project",
  "description": "Schema for the project-level spec file (project.json). Defines project metadata, top-level requirements, and module declarations with inter-module dependencies. IDs are 12-character hex identity hashes.",
  "type": "object",
  "required": ["name", "modules"],
  "additionalProperties": false,
  "properties": {
    "name": {
      "type": "string",
      "minLength": 1,
      "description": "Project name."
    },
    "description": {
      "type": "string",
      "description": "Project description."
    },
    "version": {
      "type": "string",
      "description": "Project version string."
    },
    "requirements": {
      "type": "array",
      "description": "Project-level requirements (functional and non-functional).",
      "items": { "$ref": "#/$defs/requirement" }
    },
    "modules": {
      "type": "array",
      "description": "Module declarations. Each module has its own directory with a module.json.",
      "minItems": 1,
      "items": { "$ref": "#/$defs/module" }
    },
    "sections": {
      "type": "array",
      "description": "Project-level sections with typed envelopes and freeform content.",
      "items": { "$ref": "#/$defs/section" }
    },
    "spec_version": {
      "type": "integer",
      "description": "The spec format version this project speaks. Optional; absent means version 1. Lives in project.json only — module files carry no version field."
    }
  },
  "$defs": {
    "identityHash": {
      "type": "string",
      "pattern": "^[0-9a-f]{12}$",
      "description": "12-character hex identity hash (see schema.IdentityHash)."
    },
    "requirement": {
      "type": "object",
      "required": ["id", "type", "name"],
      "additionalProperties": false,
      "properties": {
        "id": {
          "type": "string",
          "pattern": "^[a-f0-9]{12}$",
          "description": "Identity hash ID (12-char hex), unique within the requirements array."
        },
        "type": {
          "type": "string",
          "enum": ["functional", "non_functional"],
          "description": "Requirement type."
        },
        "name": {
          "type": "string",
          "minLength": 1,
          "description": "requirement name."
        },
        "description": {
          "type": "string",
          "description": "requirement description."
        },
        "priority": {
          "type": "integer",
          "minimum": 0,
          "maximum": 4,
          "description": "Requirement priority (0-4). Optional; enforced by validator when present."
        },
        "depends_on": {
          "type": "array",
          "description": "Identity hashes of other requirements this one depends on (depends_on edge).",
          "items": {
            "type": "string",
            "pattern": "^[a-f0-9]{12}$"
          },
          "uniqueItems": true
        },
        "derivation": {
          "type": "string",
          "enum": ["pending"],
          "description": "Declares a requirement not yet derived into any module. Project-scoped only: a module requirement derives by construction through its required preq_id."
        }
      }
    },
    "module": {
      "type": "object",
      "required": ["id", "name", "path"],
      "additionalProperties": false,
      "properties": {
        "id": { "$ref": "#/$defs/identityHash" },
        "name": {
          "type": "string",
          "minLength": 1,
          "description": "Module name."
        },
        "path": {
          "type": "string",
          "minLength": 1,
          "description": "Relative path to the module directory containing module.json."
        },
        "description": {
          "type": "string",
          "description": "Module description."
        },
        "requires_module": {
          "type": "array",
          "description": "Identity hashes of other modules this one depends on (requires_module edge).",
          "items": { "$ref": "#/$defs/identityHash" },
          "uniqueItems": true
        }
      }
    },
    "section": {
      "type": "object",
      "required": ["id", "name", "type"],
      "properties": {
        "id": { "$ref": "#/$defs/identityHash" },
        "name": {
          "type": "string",
          "minLength": 1,
          "description": "Section name."
        },
        "type": {
          "type": "string",
          "minLength": 1,
          "description": "Section type (e.g. 'coupled')."
        }
      }
    }
  }
}
