{
  "description": "The spec state machine.",
  "modules": [
    {
      "description": "JSON Schema definitions for project.json and module.json.",
      "id": "000000000001",
      "name": "Schema",
      "path": "schema"
    },
    {
      "description": "Spec directory validation.",
      "id": "000000000002",
      "name": "Validator",
      "path": "validator",
      "requires_module": [
        "000000000001"
      ]
    },
    {
      "description": "Hash tree, snapshots, diff, impact classification.",
      "id": "000000000003",
      "name": "Merkle",
      "path": "merkle",
      "requires_module": [
        "000000000001"
      ]
    }
  ],
  "name": "spex-machina",
  "requirements": [
    {
      "description": "Given a spec directory, confirm it is a valid DAG with no orphans, no cycles, no broken references.",
      "id": "000000000001",
      "priority": 2,
      "name": "Validate spec structure",
      "type": "functional"
    },
    {
      "depends_on": [
        "000000000001"
      ],
      "description": "Hash every node, store snapshots, diff against previous snapshots.",
      "id": "000000000002",
      "name": "Compute merkle tree",
      "type": "functional"
    },
    {
      "description": "Given the same spec state and snapshot, always produce the same diff, impact, and actions.",
      "id": "000000000003",
      "name": "Deterministic output",
      "type": "non_functional"
    }
  ],
  "version": "0.1.0"
}
